Signatur;Autor:in Nachname;Autor:in Vorname;Titel;Jahr der Veröffentlichung;Schlagwort;Klappentext;ISBN;Sprache
Ahrens;Ahrens ;Stephan;Lehrbuch der Psychotherapeutischen Medizin;1997;Psychotherapie;Der hauptberuflich psychotherapeutisch tätige firmiert künftig als Facharzt für psychotherapeutische Medizin zusätzlich gibt es den Facharzt für Psychiatrie und Psychotherapie. Diese formalen Ebene scheint Bewegung in die aktuelle Annäherung der Bereiche Psychotherapie und Psychiatrie zu bringen. Im Sinne dieser sich an waren in den Kooperation zwischen psychotherapeutischen und psychiatrischen Institution stellt das Buch gleichermaßen Starthilfe wie Wissensbasis für die Weiterbildung in diesen Fachbereichen dar. Es steckt den Rahmen psychotherapeutischer in die Kationen ab stellt eine differenzierte Krankheitslehre auf der Basis psychoanalytische Theorie ihn vor und zeigt das Spektrum psychotherapeutischer Behandlungsansätze und Indikatoren auf: Das Lehrbuch als Leitfaden für den psychotherapeutischen Zugang zum Patienten. Fachlich besonders ausgewiesene Autorinnen und Autoren haben ihre Kompetenz und ihre zum Teil sehr persönlichen Erfahrungen eingebracht. In einer einheitlichen, die taktisch einprägsam Gliederung und Durchfall Beispiele illustriert, ist darum ein ebenso lebendiges wie fundiertes und praxisanleitendes Lehrbuch entstanden, das durch sehr ausführliche Fach- und Personenregister sowie ein Abkürzungsverzeichnis gleichzeitig als Nachschlagewerk dient.;3-7945-1637-3;Deutsch
Aldridge01;Aldridge;David;Music Therapy World - Musiktherapie in der Behandlung von Demenz;2003;Demenz;"Hauptsächlich innerhalb der letzten zehn Jahre entwickelten Musiktherapeuten ihre Aerbeit mir älteren Menschen und mit Demenzpatienten. Das Buch ""MUSIC THERAPY WORLD -MUSIKTHERAPIE IN DER BEHANDLUNG VON DEMENZ"" basiert auf unterschiedlichen Forschungsstudien und den umfangreichen persönlichen Erfahrungen von Musiktherapeuten aus aller Welt; als eine Möglichkeit Erinnerungsvermögen, Gesundheitszustand und Identität von Menschen zu verbessern, die an Demenz und insbesondere an Alzheimer leiden. Hier werden Fragen angesprochen, die sich aus der Arbeit mit diesen Patienten ergeben, etwa der Umgang mit Kriegserinnerungen; es wird beschrieben, wie Musiktherapie auf dem Weg über Töne und Bewegungen die Kommunikation fördert oder überhaupt erst ermöglicht. Dieses frische, originelle Buch ist interessanter, informativer Lesestoff für Betreuende und Familienangehörige von Demenzpatienten und gleichzeitig für Musiktherapeuten und alle diejenigen, die in der Psychogeratrie tätig sind. David Aldridge ist Inhaber des Lehrstuhls für Qualitative Forschung in der Medizin der Fakultät für Medizin an der Universität Witten/Herdecke (Deutschland). Weitere Informationen finden Sie im Internet unter http://www.musictherapyworld.de";3-8334-1045-1;Deutsch
Aldridge02;Aldridge;David;Musiktherapie in der Medizin;1999;Medizinische Forschung;"Künstlerische Therapieformen sind durchaus der in der Medizin üblichen Wirksamkeitsforschung zugänglich - vorausgesetzt, man lässt sich methodisch auf die Besonderheiten des Therapieprozesses ein. Dieses Buch schlägt die Brücke zwischen traditioneller Medizin und Musiktherapie. Anhand von Falldarstellungengen belegt es, dass Musiktherapie bei einer Vielzahl von medizinischen Indikatoren, u.a. Bei AIDS, Krebs, Koma, Altersdemenz, und bei frühkindlichem Autismus, eine vielversprechende Form der Behandlung ist. Insbesondere für palliative und Rehabilitationsmedizin ist eine von der Musiktherapie inspirierte ""symphonische"" Betrachtungsweise des Menschlichen Körpers außerordentlich befruchtend. Gleichzeitig werden die Möglichkeiten einer Forschungsentwicklung aufgezeigt, mit deren Hilfe die klinische Bedeutung von Musiktherapie darstellbar wird. Indem der Autor die klinische Praxis mit wissenschaftlichen Aspekten verwebt, zeigt er vielfältige Wege, auf denen eine Wissenschaftskultur aus der Praxis heraus entwickelt werden kann - zum Nutzen aller Beteiligten. Dieses Buch beleuchtet die therapeutischen Aspekte in einer Weise, die es nicht nur für Musiktherapeuten zu einer wertvollen Leküre machen, sondern auch für Studenten, Angehörige von Gesundheitsberufen, Kunsttherapeuten, Ärzte, Pflegende, Hospizmitarbeiter oder diejenigen, die mit chronisch kranken Menschen oder Sterbenden arbeiten.";3-456-82901-9;Deutsch
Aldridge03;Aldridge;David, Gudrun;Melody in Music Therapy. A therapeutic Narrative Analysis;2008;Melody;"Melody is thought to be an 'essential core' of music. In the context of music therapy, looking at how patients develop their own melodies in improvisation can explain how they find their own voice, determine their position in relation to the world, and play an important role in how they relate to their therapist.

Gudrun Aldridge and David Aldridge explore the concept of melody within its historical context and investigate current theories of melody. They make recommendations for choosing an appropriate method of analysing melodic improvisation, and utilise case studies to demonstrate these analyses in practice. They show how the interaction between patient and therapist is affected by the patient's melodic statements, and how the process of improvisation offers patients a chance to transform their inner emotions into externalised expressions.

Melody in Music Therapy is an important addition to music therapy literature, and will be of interest to music therapists, educators and students alike, as well as musicologists.";978-1-85302-755-0;Englisch
Alvin;Alvin;Juliette;Musiktherapie. Ihre Geschichte und ihre moderne Anwedung in der Heilbehandlung;1984;;Die Musiktherapie ist in unserer Zeit ein hochaktuelles Thema. Die weltweit anerkannte englische Musiktherapeutin Juliette Alvin schildert die Geschichte und die gegenwärtige Anwendung der Musiktherapie in der Behandlung, Rehabilitation, Erziehung und Förderung von Kindern und Erwachsenen, die an körperlichen, geistigen oder seelischen Störungen leiden.;3-423-04419-5;Deutsch
Alwast;Alwast;Angelika;Seinsklänge;2016;Klang, Zelt, Rhythmus;"Vorwort Auszug:
– Worin liegen die magischen, den Hörenden verwandelnden Kräfte der
Musik?
– Was ist Musik als Musik? Sinnstiftendes Ereignis – ein poetisches Erleb-
nis? Ein neurophysiologischer Synapsen-Konnex?
„Philosophische Entwicklungspsychologie“ findet sich in diesem Satz An- gelika Alwasts: „Die Dimension, in die Musik hineinführt, sind die Dimen- sionen des Lebens selbst.“ Alle Leserinnen, die vorzugsweise nur einzelne Ausschnitte lesen, soll- ten mit der Fabel Homers von der Leier des Hermes beginnen, weil sie da einer Schildkröte begegnen, deren Innenraum uns durch diese originäre und originelle Autorin in den Folgekapiteln vertraut gemacht wird durch die Fragen, die der Schildkrötenpanzer als künftige Leier aufwirft, z. B.:
Was sind die dem Wesen der Musik eigenen Wurzeln in der (griechi- schen) Mythologie, die als Grundwasser in der Seelengeschichte des Men- schen in unserem Kulturkreis plätschert? Ein Kulturkreis, dessen Wurzeln wir umso mehr pflegen sollten, je mehr er sich durch Globalisierung, durch Völkerwanderung vermischen wird mit anderen Kulturkreisen – zu hof- fentlich wechselseitiger weiterer Kreativierung unseres Fühlens, Denkens und Handelns für uns selbst und für und mit unseren Patienten. So denken wir mit der Autorin über den Zusammenhang zwischen Mythos und thera- peutischem Prozess nach.
Weitere Beispielfrage:
Wie kommt es zu der Wechselwirkung zwischen Musik und Bewusst- sein? Diesmal antworten weniger die Neuropsychologie und -physiologie, sondern Immanuel Kant mit seiner transzendentalen Perspektive (aus der heraus ich die transzendierende Funktion der Musik neu verstand und in den Katalog der Funktionen der Musik in der menschlichen Psyche auf- nahm).
Dieses kleine Buch thematisiert die große Aufgabe der Musik als „ge- stalteter Zeit-Sinn“, und wer noch bei dem Wiener Professor Haase seine harmonikalen Grundlagen studierte, wird neben Wiederkennung eine neue Auffassung von Harmonik kennenlernen.
Ich habe das Buch als Anlass für eine längst fällige Neu-Tapezierung meines Wissens um die Philosophie der Musik nehmen können – und wünsche dies nicht nur einigen, sondern etlichen kollegialen und anderen interessierten Lesern!
Prof. Dr. Dr. h. c. Hans-Helmut Decker-Voigt Prof. h. c. der Kunstwissenschaften
März 2016";978-3-95490-167-8;Deutsch
Alwast;Alwast;Angelika;Seinsklänge;;;;;
Auch-Johannes, Weymann;Auch-Johannes, Weymann;Inga;Klangbrücken. Musiktherapie in der häuslichen Versorgung vin Menschen mit Demenz - ein Leitfaden für die Praxis;2015;Demenz, häusliche Versorgung, Kommunikation;Musiktherapie gilt mittlerweile als eine wirksame Methode der Begleitung von Menschen mit Demenz. Die Erkrankung verändert allmählich die Wahrnehmungen und sozialen Bezüge der Betroffenen, die oft über langeZeit von ihren nächsten Angehörigen zu Hause versorgt werden. In dieser Situation kann ambulante, aufsuchende Musiktherapie hilfreich sein. Das Buch bietet einen Leitfaden für den Aufbau spezifischer musiktherapeutischerAngebote in diesem Bereich. Es wendet sich in erster Linie an MusiktherapeutInnen, spricht aber auch AltenpflegerInnen und Angehörige anderer benachbarter Berufe an. Auch für die pflegenden Angehörigen sind die bereitgestellten Informationen von Interesse. Im Zentrum des Buches steht die Darstellung der ambulanten Musiktherapie und einer Gruppen-Veranstaltung für die Angehörigen. Vor dem Hintergrund aktueller Forschungsergebnisse werden konkrete Hilfestellungen zum Einstieg gegeben und mit zahlreiche Fallvignetten praxisnah verdeutlicht.;978-3-95490-156-2;Deutsch
Aulbert;Aulbert;Eberhard;Lehrbuch von Palliativmedizin;2007;Palliativmedizin;"Im Mittelpunkt der Palliativmedizin steht die Behandlung und Begleitung von Patienten mit einer nicht heilbaren, progredienten und weit fortgeschrittenen Erkrankung bei begrenzter Lebenserwartung, wie z. B. Tumorerkrankungen, AIDS, chronische internistische, neurologische und geriatrische Erkrankungen sowie pädiatrische Stoffwechselerkrankungen in der Terminalphase.
Ziele des ganzheitlichen Behandlungskonzeptes sind die umfassende und fachgerechte Linderung belastender Krankheitssymptome, Hilfe bei der Krankheitsbewältigung, Rehabilitation, Verbesserung der Lebensqualität und Sterbebegleitung. Um diese zu erreichen, ist es notwendig, dass Ärzte verschiedener Fachrichtungen, Pflegepersonal und alle anderen Berufsgruppen, die unheilbar Kranke betreuen, auf diesem Gebiet sehr gut aus-, fort- und weitergebildet sind und eng miteinander kooperieren. Eine extreme Herausforderung, bei deren Bewältigung dieses Lehrbuch eine große Hilfe ist.";3-7945-2361-X;Deutsch
Badcock;Badcock;Christopher;Psycho - darwinismus, Die Synthese von Darwin und Freud;1999;Psychoanalyse;Auf diesen Begriff bringt Christoph Badcock das von ihm entdeckte faszinierende Zusammmenspiel von Evolution und Seele. Noch nie wurde so anschaulich dargestellt, wie unser genetisches Verhaltensprogramm und die Prägungen, die wir durch die Umwelt erfahren, miteinander kooperieren. Dieses Buch entwickelt aus den Erkenntnisen von Darwin und Freud ein völlig neues Bild des Menschen.;3-446-17500-8;Deutsch
Batel;Batel;Günther;Spiellieder und Bewegungsspiele in der Musiktherapie;1992;Spiel, Bewegung, Gesang;"Spiel, Bewegung, Gesang sind besonders geeignete Medien zur Verwirklichung musiktherapeutischer und sozialpädagogischer Zielsetzungen, da es betont kommunikative Medien sind. Sie bieten ein Übungsfeld für soziale Verhaltensweisen und bereichern die Erlebnis. Und Kommunikationsmöglichkeiten; zusätzlich fördern sie die gesamte-rötliche Geschicklichkeit. Dieses kommt insbesondere in den Spielliedern und Bewegungspielen der Kinder zum Ausdruck. Dieser Wand befasst sich mit der Bedeutung von Musik, Spiel und Bewegung im therapeutischen Prozess und untersucht dabei speziell die musiktherapeutische Relevanz von Spielliedern und Bewegungspielen der Kinder. Daraus resultieren wichtige Modelle für musiktherapeutischen Kommunikationsspiele, die ausführlich erläutert werden.";3-437-11433-6;Deutsch
Baumann;Baumann;Urs;Indikation zur Psychologie. Perspektiven für Praxis und Forschung.;1981;Klinische Psychologie, Psychotherapie, Indikation;Es gibt heute eine Vielfalt von Methoden, die alle den Namen „Psychotherapie“ in Anspruch nehmen. Die Palette reicht vom begründeten verantwortungsvollen Handeln bis zur Heilslehre. Für verschiedene Gruppen – Klienten, Therapeuten, Wissenschaftler, Behörden – ist daher die Indikationsfrage von größter Bedeutung: wann ist welche Psychotherapie angebracht? Im vorliegenden Buch befassen sich mit dieser Frage Autoren aus den Bereichen Psychotherapie, Psychosomatik, Psychiatrie, Psychopharmakotherapie, Methodik und Wissenschaftstheorie.Sie zeigen, wie vielschichtig die Indikationsfrage ist und dass es sich verbietet, sie „kochbuchartig“ zu beantworten. Der Herausgeber Urs Baumann ist Professor für klinische Psychologie an der Universität Kiel und durch zahlreiche Publikation ausgewiesen.;3-541-09461-3;Deutsch
Bayley;Bayley;John;Elegie für Iris;2002;Liebe und Alzheimer;Iris Murdoch starb 1999 an der Alzheimerschen Krankheit. Ihr Mann, John Bayley, erzählt die Geschichte seines außergewöhnlichen Lebens mit dieser großen Schriftstellerin. Selten sind die Höhen und Tiefen einer Ehe und die unbeirrbare Macht der Liebe bewegender dargestellt worden als in diesem wunderbaren Buch.;3-7632-5056-5;Deutsch
Barnowski- Geiser;Barnowski- Geiser;Waltraut;Hören, was niemand sieht. Kreativ zur Sprache bringen, was Kinder und Erwachsene aus alkoholbelasteten Familien bewegt.;2009;Kinder und Erwachsene, Alkoholismus, Alkoholprobleme in Familien, Zur Sprache bringen;"Kinder aus alkoholbelasteten Familien sind extrem belastet: Sie erleben alltäglich Krisen, die von ihren Eltern oftmals verleugnet und von ihrem Umfeld nicht wahrgenommen werden. Die meisten derart Betroffenen leiden stumm und unerkannt, oftmals bis ins hohe Erwachsenenalter - ohne je therapeutische Hilfe erfahren zu dürfen. Die Musiktherapeutin Waltraut Barnowski-Geiser untersuchte knapp ein Jahrzehnt das Erleben der Alkoholbelastung unter leibtherapeutischen Aspekten und ermöglicht bislang verborgene Einblicke in die seelische Welt Betroffener. Sie gibt wertvolle Hilfestellungen, wie musiktherapeutische und intermediale Wege zu dieser vergessenen Hochrisikogruppe aussehen zu können. Anhand zahlreicher Fallbeispiele und ausführlicher Einzeldarstellungen aus der Arbeit mit Kindern, Jugendlichen und Erwachsenen demonstriert sie anschaulich, wie trotz der familiären Alkoholbelastung durch das von ihr speziell für die Zielgruppe entwickelte ""AWOKADO-Konzept zu sanften Entlastung"" praxisnahe Hilfe möglich werden kann. Das Buch für die kompetente und angemessene Theorie und Praxis von Alkoholbelastung - eine unverzichtbare Orientierungshilfe für Menschen, die sich dem Erleben dieser immer größer werdenden Zahl Betroffener annähern möchten.";978-3-934933-26-2;Deutsch
Blaser;Blaser;Andreas ;Problemorientierte Musiktherapie. Ein integratives Konzept;1992;Psychologie, Lehre, Psychotherapie;Dieser psychotherapeutische Leitfaden wurde von Praktikern für die Praxis geschrieben. Die Anwendung integrativer Psychotherapie wird theoretisch begründet. Die Hauptmerkmale sind konsequente Patienten- und Problemorientiertheit, Methodenpluralismus und Strukturierung von Aufbau und Ablauf der Therapie. Elemente wirksame Psychotherapieformen werden in ein theoretisches Konzept integriert und durch eine pragmatische Indikationsstellung therapeutisch um gesetzt. Ein wesentlicher Aspekt ist die didaktische Zielsetzung des Buches, dass ich deshalb besonders gut zum Erwerb psychotherapeutischen Basiswissens eignet. Dem erfahrenen Psychotherapeuten erlaubt es, sein Wissen und Können zielgerecht anzuwenden.;3-456-82143-3;Deutsch
Blackenburg, von;Blackenburg, von;Albrecht;Musiktherapie mit Senioren;2004;Senioren, Alte Menschen, Altersheim ;Freude, Kreativität und neue Erlebnisse mit Hilfe von Musik können auch ältere Menschen erleben. Dieses Buch soll Anregung und Hilfe sein, das Behandlungsangebote der Musiktherapie noch viel stärker für Senioren zu öffnen und zu erweitern. Ausgehend von einem Erfahrungsbericht gibt der Autor praktische Vorschläge zur Gestaltung von aktiver Musiktherapie unter Verwendung von Orff#schem Instrumentarium.;3-8248-0003-9;Deutsch
Blunt;Blunt;Leslie;Musiktherapie. Eine Einführung für psychosoziale und medizinische Berufe;1998;Grundlagen der Anwendung der Musiktherapie;Ein Standartwerk, dass eine schulen-vergreifende Gesamtdarstellung der Musiktherapie bietet. Das Buch gibteinen für uns hochaktuellen Überblick über die Anwendung der Musiktherapie im angloamerikanischen Raum. Dabei geht es sowohl um die Prävention un der Musik- und Sozialpädagogik als auch um soziale Kulturarbeit. Ausführlich wird die Musiktherapie in der stationären und ambulanten Kinder-, Jugend-, und Erwachsenenpsychatrie und -Neurologie dargestellt. In sehr lebendiger Weise wird die Fach Diskussion vermittelt, wobei der Autor eindrucksvolle Fälle aus der Behandlungspraxis einbezieht. Er berichtet über Forschungen, die die Effizienz der Musiktherapie belegen und für uns neuartig sind. Das Buch bietet deshalb vielfältige Anregungen zum Einsatz von Musiktherapie im Kontext sozialpädagogischer gesundheitspolitische Aufgaben.;3-407-55811-2;Deutsch
Bolay;Bolay;Hans Volker;Musiktherapie als Hochschuldisziplin in der Bundesrepublik Deutschland;1985;Ausbildung Musiktherapie;Erst in den letzten Jahren hat sich in der Bundesrepublik Deutschland die Musiktherapie als Ausbildungsdisziplin installiert. Die Musik therapeutische Ausbildungslandschaft ist derzeit jedoch schwer überschaubar und bietet insbesondere dem musiktherapeutischen Laien ein recht widersprüchliches Bild. Musiktherapeutische Weiterbildungs – und Fortbildungsangebote stehen neben Versuchen musiktherapeutische Schwerpunktbildungen in fachfremden Studiengängen sowie ersten vielversprechenden Bemühungen um eine grundständige musiktherapeutische Ausbildung auf Fachhochschuleebene. Die vorliegende Arbeit bietet einen umfassenden Überblick über die aktuelle Entwicklung der Musiktherapie im Ausbildungsbereich und berücksichtigt dabei im Rahmen einer vergleichende Analyse sowohl Studienstruktur, Studienorganisation, inhaltliche Konzeption und Schwerpunktbildung in der Bundesrepublik Deutschland vorzufindenden musiktherapeutischen Ausbildungsangebote als auch deren didaktische Vorgehensweisen und Zielvorstellungen. Darüber hinaus wird im Rahmen dieser Arbeit einer Grundsaatzdiskussion zur Frage der Lehrbarkeit und Überprüfbarkeit psychotherapeutisch-Musiktherapeutischer Kompetenz Stellung genommen.;3437109812;Deutsch
Boller01;Boller;Rainer;Musiktherapeut als Beruf. Anspruch und Wirklichkeit Musiktherapeutischer Arbeit in der Bundesrepublik Deutschland;1985;Aufgabengebiete von Musiktherapie, Praxis;Die Musiktherapie macht erst seit geraumer Zeit den Versuch, sich mit Hilfe eines wissenschaftlichen Instrumentariums und wissenschaftlicher Methoden zur artikulieren, ihre Aufgabengebiete festzulegen und darüber nachzudenken, wer denn nun eigentlich als „Musiktherapeut“ bezeichnet werden können und des Nachweises welche Fähigkeiten und Fertigkeiten es bedürfe, um diese Berufsbezeichnung tragen und angemessen vertreten zu können. Ausgehend von einschlägigen Definitionsversuchen von „Musiktherapie“ wird in der vorliegenden Arbeit untersucht, ob beziehungsweise inwieweit sich diese in der Literatur aufzufinden Standortbestimmung mit dem musiktherapeutischen Alltag der Betroffenen sowie mit den Vorstellungen und Erwartungen potentieller Arbeitgeber von Musiktherapeuten in Übereinstimmung bringen lässt. Die im Rahmen empirische Untersuchungen werden insbesondere Anforderungen und Tätigkeitsmerkmale musiktherapeutische Arbeit untersucht, darüber hinaus werden potentielle Arbeitgeber von Musiktherapeuten zu den Vorstellungen und Erwartungen befragt, die sie mit musiktherapeutischer Arbeit verbinden. Im weiteren werden berufspolitische Fragen der Musiktherapie eben so diskutiert wie das Verhältnis der Musiktherapie zu anderen Berufsgruppen innerhalb des therapeutischen Teams. Die Entwicklung alternativer musiktherapeutischer „Berufsmöglichkeiten“ wird als wesentliche Aufgabe praktizierender Musiktherapeuten vorgestellt.;3-437-10982-0;Deutsch
Boller02;Boller;Rainer;Musiktherapeut als Beruf. Anspruch und Wirklichkeit Musiktherapeutischer Arbeit in der Bundesrepublik Deutschland;1985;Aufgabengebiete von Musiktherapie, Praxis;Die Musiktherapie macht erst seit geraumer Zeit den Versuch, sich mit Hilfe eines wissenschaftlichen Instrumentariums und wissenschaftlicher Methoden zur artikulieren, ihre Aufgabengebiete festzulegen und darüber nachzudenken, wer denn nun eigentlich als „Musiktherapeut“ bezeichnet werden können und des Nachweises welche Fähigkeiten und Fertigkeiten es bedürfe, um diese Berufsbezeichnung tragen und angemessen vertreten zu können. Ausgehend von einschlägigen Definitionsversuchen von „Musiktherapie“ wird in der vorliegenden Arbeit untersucht, ob beziehungsweise inwieweit sich diese in der Literatur aufzufinden Standortbestimmung mit dem musiktherapeutischen Alltag der Betroffenen sowie mit den Vorstellungen und Erwartungen potentieller Arbeitgeber von Musiktherapeuten in Übereinstimmung bringen lässt. Die im Rahmen empirische Untersuchungen werden insbesondere Anforderungen und Tätigkeitsmerkmale musiktherapeutische Arbeit untersucht, darüber hinaus werden potentielle Arbeitgeber von Musiktherapeuten zu den Vorstellungen und Erwartungen befragt, die sie mit musiktherapeutischer Arbeit verbinden. Im weiteren werden berufspolitische Fragen der Musiktherapie eben so diskutiert wie das Verhältnis der Musiktherapie zu anderen Berufsgruppen innerhalb des therapeutischen Teams. Die Entwicklung alternativer musiktherapeutischer „Berufsmöglichkeiten“ wird als wesentliche Aufgabe praktizierender Musiktherapeuten vorgestellt.;3-437-10982-0;Deutsch
Bright;Bright;Ruth;Musiktherapie in der Altenhilfe;1984;Altenhilfe;Der vierte Band im Rahmen der Reihe „Praxis der Musiktherapie“ bietet eine Übersicht über die Einsatzmöglichkeiten der Musiktherapie bei alten Menschen, insbesondere in Krankenhäusern, Pflegeheimen und Altenzentren. Überall dort, wo ältere Menschen von ihrer Umwelt abgekapselt sind, wo sie unter Schmerzen, Ängsten und Vereinsamung leiden und sich unglücklich fühlen, können Sie durch die Musiktherapie mit dem Ziel der Bildung neuer Beziehungen angesprochen werden. Musik kann dabei als intellektuelle Herausforderung, als Quelle des Vergnügens und als Assoziation zur Vergangenheit eine segensreiche WIrkung entfalten. Somit gehört dieses Buch in die Hände aller Therapeuten, die sich mit alten Menschen befassen.;3-434-10880-8;Deutsch
Bruhn;Bruhn;Herbert;Musiktherapie. Geschichte - Theorien - Methoden;2000;Theoretische Grundlagen;Seit Jahrtausenden wird Musik von Menschen zur Heilung von Krankheiten eingesetzt, aber erst ab Mitte des 20. Jahrhunderts sind die vielfältigen Methoden so weiterentwickelt worden, dass ein gezielter Einsatz von Musiktherapie als Psychotherapie möglich wurde. Sehr effektiv ist Musiktherapie bei der Bearbeitung von Konflikten, die aus unterschiedlichen Gründen mit sprachlichen Möglichkeiten nicht bewusst gemacht werden können. In manchen Fällen wird Musiktherapie eingesetzt, um Lernen zu unterstützen oder um Beeinträchtigungen durch Unfall oder Schlaganfall zu bewältigen. Bei Behinderungen, die dauerhaft und unveränderbar existieren, kann Musiktherapie auf eine Verbesserung des Erlebens ausgerichtet sein. Das Buch beschreibt die Entwicklung der Musiktherapie, den Kern der Methoden, der allen Richtungen der Musiktherapie gemeinsam ist, sowie die Anwendungsfelder der Musiktherapie.;3-8017-1325-3;Deutsch
Cramer;Cramer;Annette;Tinnitus: Wirksame Selbsthilfe durch Musiktherapie;2002;Tinnitus, CD im Booklet;"Mit sanften Klängen gegen Tinnitus

Das erste Hör-Programm - für Sie individuell zum Kombinieren

Fast jeder 10. Deutsche ist von Tinnitus betroffen. Dabei bietet die Musiktherapie gerade langfristig Betroffenen verblüffende Erfolge. Erproben Sie die heilende Kraft der tinnituszentrierten Musiktherapie. Das Besondere daran: Sie kombinieren die Übungen selbst. 

Gezielte Klangangebote verbessern Ihre Hörleistung 

Eine Vielfalt von Klang- und Musikbeispielen bieten Ihnen die zwei CDs. Mit umfangreichen Hörtests lernen Sie Ihr Ohrgeräusch genau einzuschätzen. Und auch jene Hörstörungen, die häufig damit verbunden sind. In 7 Schritten bauen Sie Ihr passendes Selbsthilfeprogramm auf. 

Mit dem 3-Wochen-Basistraining erlangen Sie wieder größeres Hörvergnügen

Das dreiwöchige Basistraining bietet Ihnen die Kernelemente einer erfolgreichen Behandlung. Beim richtigen Zuhören lernen Sie sich tief zu entspannen. Die Innenohr-Gymnastik verbessert Ihre subjektive Hörwahrnehmung. Und schließlich lernen Sie mit der richtigen Musik wieder aktiv zu hören - und damit den Tinnitus einfach nicht mehr wahrzunehmen. 

""Wer trotz seines Leidens am Tinnitus aktiv an dieses Buch gehen kann, der hat die Chance, wieder handlungsfähig und dabei zum Komponisten des eigenen Lebens zu werden."" Dr. H. Schaaf, Leitender Oberarzt der Tinnitus-Klinik Bad Arolsen";978-3830430070;Deutsch
