Signatur;Autor:in Nachname;Autor:in Vorname;Titel;Jahr der Veröffentlichung;Schlagwort;Klappentext;ISBN;Sprache
Frohne-Ha01;Frohne-Hagemann, Pleß-Adamczyk;Isabellle;Indikation Musiktherapie bei psychischen Problemen im Kindes- und Jugendalter. Musiktherapeutische Diagnose und Manual nach ICD-10;2005;Kinder, Jugendliche, Psyche, Probleme ;"Isabelle Frohne-Hagemann und Heino Pleß-Adamczyk kommt das Verdienst zu, für die Musiktherapie mit Kindern und Jugendlichen mit diesem Band die Grundlagen für störungsspezifische Indikationen zu liefern, wie sie inzwischen von Psychotherapieverfahren gefordert werden. Die Autoren bedienen sich einer integrativen Sichtweise, die die spezifisch musiktherapeutische Diagnostik vor dem Hintergrund verschiedener Theoriemodelle anderer Verfahren anschaulich macht. Das abschließende Manual gibt einen praxisbezogenen Überblick zu den relevanten Störungsbildern nach ICD-10 und vermittelt exemplarisch, welche beziehungsfördernden Funktionen Musik bei spezifischen Symptomatiken in der musiktherapeutischen Behandlung haben kann.

Heino Pleß-Adamczyk M.A. ist Gestalt-Musiktherapeut, Supervisor und Kinder- und Jugendlichenpsychotherapeut in eigener Praxis in Berlin.";978-3-525-46211-9;Deutsch
Frohne-Ha01a;Frohne-Hagemann, Pleß-Adamczyk;Isabellle;Indikation Musiktherapie bei psychischen Problemen im Kindes- und Jugendalter. Musiktherapeutische Diagnose und Manual nach ICD-10;2005;Kinder, Jugendliche, Psyche, Probleme ;"Isabelle Frohne-Hagemann und Heino Pleß-Adamczyk kommt das Verdienst zu, für die Musiktherapie mit Kindern und Jugendlichen mit diesem Band die Grundlagen für störungsspezifische Indikationen zu liefern, wie sie inzwischen von Psychotherapieverfahren gefordert werden. Die Autoren bedienen sich einer integrativen Sichtweise, die die spezifisch musiktherapeutische Diagnostik vor dem Hintergrund verschiedener Theoriemodelle anderer Verfahren anschaulich macht. Das abschließende Manual gibt einen praxisbezogenen Überblick zu den relevanten Störungsbildern nach ICD-10 und vermittelt exemplarisch, welche beziehungsfördernden Funktionen Musik bei spezifischen Symptomatiken in der musiktherapeutischen Behandlung haben kann.

Heino Pleß-Adamczyk M.A. ist Gestalt-Musiktherapeut, Supervisor und Kinder- und Jugendlichenpsychotherapeut in eigener Praxis in Berlin.";978-3-525-46211-9;Deutsch
Frohne-Ha02;Frohne-Hagemann, Pleß-Adamczyk;Isabellle;Musik und Gestalt. Klinische Musiktherapie als integrative Psychotherapie.;1990;Psychotherapie, Ganzheitlichkeit, Musik, Klang, klinisch – Praxeologischen Gesichtspunkten;Obwohl Musik, Spiel und Tanz seid ihr tausenden als Möglichkeiten bekannt sind, Körper und Seele des Menschen im ganzheitlichen Sinne zu integrieren, befindet sich Musiktherapie ihr seid alle Jungs zur Zeit auf dem Wege zu einer wissenschaftlichen fundierten ganzheitlichen Psychotherapie.Im Laufe der Jahrhunderte wurde mit der Heilkraft der Musik auf verschiedensten Gebieten experiementiert, und es wurden viele interessante Möglichkeiten entdeckt, Musik und Klang zu erforschen und therapeutisch zu nutzen.;3-87387-011-8;Deutsch
Graubner;Graubner;Bernd;ICD-10-GM. 2010. Systematisches verzeichnis. Internationale statistische Klassifikation der Krankheiten und verwandter Gesundheitsprobleme. 10.Revision - German Modification;2009;Klassifikation der Krankheiten, Statistik, Gesundheitsprobleme;;978-3-7691-3442-1;Deutsch
Grocke, Wigram;Grocke, Wigram;Denise;Receptive Methods in Music Therapy. Techniques and linkslastigstem Applications for Music Therapy Clinicians, Educators and STudents;2007;Rezeptive Methoden, Techniken, Praxisbeispiele, Klinik;"This practical book describes the specific use of receptive (listening) methods and techniques in music therapy clinical practice and research, including relaxation with music for children and adults, the use of visualisation and imagery, music and collage, song-lyric discussion, vibroacoustic applications, music and movement techniques, and other forms of aesthetic listening to music. The authors explain these receptive methods of intervention using a format that enables practitioners to apply them in practice and make informed choices about music suitable for each of the different techniques. Protocols are described step-by-step, with reference to the necessary environment, conditions, skills and appropriate musical material.

Receptive Methods in Music Therapy will prove indispensable to music therapy students, practitioners, educators and researchers.";1-84310-413-x;Englisch
Grootaers;Grootaers;Frank G.;Bilder Behandeln Bilder. Musiktherapie als angewandte Morphologie;2000;Bilder, Behandlung, angewandte Morphologie;Dreizehn Einzelfallstudien zeigen auf, wie gestörte Lebensbilder sich lösungsorientiert verwandeln lassen. Die gemeinsame musikalische Produktion ist hierbei der entschiedene Ansatz. Die Verlaufsschilderung von mehrwöchigen musiktherapeutischen Gruppenbehandlungen macht beschaubar, wie die Lebensbilder solcher Gruppen in Verwandlung geraten und so Profit für den Einzelnen bringen. Der vorliegende epische Beitrag zur Morphologie der Musiktherapie führt aus, wie konzeptgeleitete klinische Behandlung wirkungsvoll funktioniert. Das Buch richtet sich an Musiktherapeutinnen und Musiktherapeuten sowie an alle, die an Psychotherapie interessiert sind.;3-8258-5339-x;Deutsch
Hamel;Hamel;Peter Michael;Ein neuer Ton. Ausgewählte Schriften zu einer ganzen Musik;2007;Klang, Kulturphilosophie, Kulturethnographie;"Peter Michael Hamel - Komponist von Orchester-, Chor- und Kammermusikwerken, Musiker und Improvisationskünstler, Schriftsteller und Denker - gewährt in dieser Sammlung ausgewählter Schriften und Gespräche tieferen Einblick in seine Klangvorstellungen von einem ""neuen Ton"". Kulturphilosophische Überlegungen sind dabei ebenso wesentlich wie seine musik-ethnologischen Erfahrungen, die ihn immer wieder zum Grenzgänger zwischen den Welten werden ließen. Doch auch Komponistenkollegen wie Luc Ferrari oder Krzystof Penderecki werden als wichtige Weggefährten ebenso gewürdigt wie sein hoch verehrter Lehrer Günter Bialas oder der ""Maestro"" Sergiu Celibidache. An der Hochschule für Musik und Theater Hamburg ist Peter Michael Hamel seit nunmehr 10 Jahren als Kompositionsprofessor in der Nachfolge von György Ligeti tätig und mit seinen Studenten in ambitionierten Projekten dem ""neuen Ton"" stets auf der Spur. Mit den vielfältigen Beiträgen aus den unterschiedlichen Schaffensperioden Peter Michael Hamels erweist sich dieses Buch nicht zuletzt auch als ein Zeitdokument der jüngeren und jüngsten Musikgeschichte.";978-3-86520-261-1;Deutsch
Hegi01;Hegi;Fritz;Improvisation und Musiktherapie. Möglichkeiten und Wirkungen von freier Musik;1990;Improvisation, freie Musik;"Improvisation hat eine musikalische, psychische und soziale Sprengkraft. Sie vermag Mauern der Konvention, Starrheit oder Blockierung zu durchbrechen. Viele lassen gerade deshalb von vornherein die Finger davon. 

In diesem Buch werden verschiedene Wege schrittweise aufgezeigt, wie mit diesem reichhaltigen Material umgegangen werden kann - als Musiker, als Therapeut, als Lehrer, Animateur oder als spielender, bewusster, neugieriger Mensch im Alltag. Thema ist die musikalische Gestalt des persönlichen Ausdrucks im Augenblick, eben der Improvisation. Ihre verändernde und heilende Kraft reicht vom aufmerksamen Zuhören auf die Umwelt, in der wir leben, bis in das künstlerische und therapeutische Jetzt - die dauernde Erfindung meiner selbst. 

Der hier vorgeschlagene Weg über das Ohr eröffnet als ganzheitliche Erfahrung ungeahnte Energien für die heute vom technischen Bewusstsein fast erdrückte Beziehungs- und Gefühlswelt. ";3-87387-207-6;Deutsch
Hegi02;Hegi;Fritz;Übergänge zwischen Sprache und Musik. Die Wirkungskomponenten der Musiktherapie;1998;Kommunikation, Sprache;Sprache, Musik und Theorie in ihren Übergängen - ein Aufbruch ins Zwischenreich der Wörter und Töne. Im kreativen Prozess vim Gespräch zum Spiel liegt das Geheimnis der Wirkung von Musiktherapie: Was passiert zwischen sprachlichem und musikalischem Kontakt? ;3-87387-353-2;Deutsch
Heim;Heim;Edgar;Problemorientierte Musiktherapie. Ein integratives Konzept (für weitere Info siehe Blaser, Andreas);;;;;
Henecka;Henecka;Nici;Ästhetik und Musiktherapie;2010;Musiktherapeutische Ästhetik, Ästhetik, Handlungsweisen;Die Neuregelung Ästhetik als philosophische Disziplin bietet relevante Gesichtspunkte für ein erweitertes Verständnis der Musiktherapie und ihrer Handlungsweisen. Berichte aus dem musiktherapeutischen Alltag werden reflektiert und im Hinblick auf eine musiktherapeutische Ästhetik ausgeweitet.;978-3-89500-740-8;Deutsch
Hennen01;Hennen;Peter;Musik als Hilfe zur Erziehung;2010;Erziehung;Musiktherapie richtet sich häufig an Kinder und Jugendliche außerhalb der klinischen Gesundheitsfürsorge, für die eine Finanzierung der therapeutischen Arbeit durch die Krankenkassen ausscheidet. Gegebenenfalls kann aber ein Leistungsanspruch gegenüber den Trägern der öffentlichen Jugendhilfe bestehen. Die Arbeit untersucht, unter welchen Voraussetzungen eine Kostenübernahme musiktherapeutischer Interventionen durch Jugendämter möglich wird.;978-3-895000-741-5;Deutsch
Hennen02;Hennen;Peter;Musik als Hilfe zur Erziehung;2010;Erziehung;Musiktherapie richtet sich häufig an Kinder und Jugendliche außerhalb der klinischen Gesundheitsfürsorge, für die eine Finanzierung der therapeutischen Arbeit durch die Krankenkassen ausscheidet. Gegebenenfalls kann aber ein Leistungsanspruch gegenüber den Trägern der öffentlichen Jugendhilfe bestehen. Die Arbeit untersucht, unter welchen Voraussetzungen eine Kostenübernahme musiktherapeutischer Interventionen durch Jugendämter möglich wird.;978-3-895000-741-5;Deutsch
Hoffmann01;Hoffmann;Prof. Dr. S.O.;Einführung in die Neurosenlehre und Psychosomatische Medizin. 3. Auflage;1987;Neurose, Psychosomatik, Psychotherapie;Neurose, Psychosomatik und Psychotherapie sind Begriffe, deren Bedeutung unbestritten, deren Kenntnis und Verständnis jedoch oft sehr begrenzt ist. Diese Einführung orientiert sich am psychoanalytische Modell, bezieht aber auch andere Betrachtungsweise ein. Die wichtigsten Begriffe und Konzepte werden in einer Allgemein Neurosenlehre entwickelt und dann auf die spezielle Lehre von den psycho neurotischen und psychosomatischen Krankheitsbildern angewandt. Eine Darstellung der Diagnostik in der analytischen Psychotherapie und eine Einführung in die wichtigsten Therapieverfahren bilden den Ausschluss. Die neueste Fassung zum Gegenstandskatalog drei für das medizinische Staatsexamen wurde berücksichtigt. Interessenten: Studenten der Medizin und Psychologie, der Sozialarbeit, Sozialpädagogik, Heilpädagogik und Verwandtschaft Fächer. Studenten und Angehörige andere Berufe, die an einer informativen Einführung in das Fachgebiet interessiert sind.       ;3-7945-1212-X;Deutsch
Hoffmann01a;Hoffmann;Prof. Dr. S.O.;Einführung in die Neurosenlehre und Psychosomatische Medizin. 3. Auflage;1987;Neurose, Psychosomatik, Psychotherapie;Neurose, Psychosomatik und Psychotherapie sind Begriffe, deren Bedeutung unbestritten, deren Kenntnis und Verständnis jedoch oft sehr begrenzt ist. Diese Einführung orientiert sich am psychoanalytische Modell, bezieht aber auch andere Betrachtungsweise ein. Die wichtigsten Begriffe und Konzepte werden in einer Allgemein Neurosenlehre entwickelt und dann auf die spezielle Lehre von den psycho neurotischen und psychosomatischen Krankheitsbildern angewandt. Eine Darstellung der Diagnostik in der analytischen Psychotherapie und eine Einführung in die wichtigsten Therapieverfahren bilden den Ausschluss. Die neueste Fassung zum Gegenstandskatalog drei für das medizinische Staatsexamen wurde berücksichtigt. Interessenten: Studenten der Medizin und Psychologie, der Sozialarbeit, Sozialpädagogik, Heilpädagogik und Verwandtschaft Fächer. Studenten und Angehörige andere Berufe, die an einer informativen Einführung in das Fachgebiet interessiert sind.       ;3-7945-1212-X;Deutsch
Holderegger;Holderegger;Hans;Der Umgang mit dem Trauma;1998;Trauma, Psychologie, Psychoanalyse;"„Der Umgang mit dem Trauma“ erschien erstmals 1993 und analysiert die Gefühlen der Hilflosigkeit und Wut von Psychoanalytikern, die in der Behandlung traumatisierter Patienten ausgelöst werden. Hans Holderegger ermöglicht mit seinem Standardwerk einen neuen Zugang zum Verständnis der Übertragungs- und Gegenübertragungsprozesse. Hans Holdereggers Standardwerk liegt heute in der 4. Auflage vor, erweitert durch eine aktualisierte Literaturliste und zwei Aufsätze – “Trauma und Übertragung” und “Inszenierung und Verwandlung"" – über die Weiterentwicklung seiner Theorien, die einen neuen Zugang zum Verständnis der Übertragungs- und Gegenübertragungsprozesse ermöglichen.

Dr. phil. Hans Holderegger, geboren 1942, Studium der Literaturwissenschaft und Ausbildung zum Psychoanalytiker. Mitglied der Schweizerischen Gesellschaft für Psychoanalyse. Vorlesungen zum Thema Pädagogik und Tiefenpsychologie an der Universität Zürich und Deutschunterricht am Gymnasium. Arbeitet in eigener Praxis und als Dozent am Freud-Institut Zürich und führt in dieser Funktion neben Seminaren auch Lehranalysen und Supervisionen durch.";3-608-95975-0;Deutsch
Hoot 01;Hoot Antink, Weymann, Ohls;Monika T.;Musiktherapeutische Umschau. Forschung und Praxis der Musiktherapie ;2019;Stimme, Selbstwert, Gruppentherapie, Depressionsbehandlung, Depressionen, Autismus, Leib musikalische Resonanzbereitschft;;0172-5505;Deutsch
Hoot 01a;Hoot Antink, Weymann, Ohls;Monika T.;Musiktherapeutische Umschau. Forschung und Praxis der Musiktherapie ;2019;Stimme, Selbstwert, Gruppentherapie, Depressionsbehandlung, Depressionen, Autismus, Leib musikalische Resonanzbereitschft;;0172-5505;Deutsch
Hoot 01b;Hoot Antink, Weymann, Ohls;Monika T.;Musiktherapeutische Umschau. Forschung und Praxis der Musiktherapie ;2019;Stimme, Selbstwert, Gruppentherapie, Depressionsbehandlung, Depressionen, Autismus, Leib musikalische Resonanzbereitschft;;0172-5505;Deutsch
Jochims;Jochims;Silke;Musiktherapie in der Neurorehabilitation;2005;Neurorehabilitation. Konzepte, Forschung, Praxis, Neurologie;Das vorliegende Buch spannt den weiten Bogen zwischen Neurorehabilitation und Musiktherapie. Es gibt einen Überblick über den Stand internationaler musiktherapeutischer Forschungsaktivität und aktuelle Behandlungsansätze bei vielen neurologischen Krankheitsbildern. Die mit Kenntnis, Bedacht und Einfühlungsvermögen zusammengestellten Einzelbeiträge machen die Bedeutung der Musiktherapie für die Wiederherstellung geschädigter höherer Hirnleistungen deutlich. Sowohl die Beiträge zur Behandlung funktionaler motorischer, sensorischer und kognitiver Defizite als auch zu Interventionen im emotionalen, krankheitsverarbeitenden und interaktiv-kommunikativen Bereich vermitteln allen in der neurologischen und neurochirurgischen Rehabilitation Tätigen tiefe Einblicke in den derzeitigen Stand von Forschung und Praxis. Die Herausgeberin präsentiert die Musiktherapie aus internationaler Sicht, um sowohl der sehr divergenten Entwicklung der Konzepte als auch der länderspezifisch sehr unterschiedlichen Zuordnung zu Krankheitsbildern aus Neurologie oder Neurorehabilitation Rechnung zu tragen. Die synoptische Darstellung macht deutlich, dass der wissenschaftliche Streit um das einzig richtige musiktherapeutische Konzept zwischen den anerkannten Schulen im Grunde unnötig ist und im Alltag nicht weiterführt.;3-936817-19-7;Deutsch
Kemmelmeyer, Probst;Kemmelmeyer, Probst;Karl-Jürgen;Quellenbesteuerung zur Pädagogischen Musiktherapie. Zur genese eines Faches;1981;Pädagogik, Grundlagen, Entstehung;;3-7649-1350-9;Deutsch
Klein;Klein;Melanie;Das Seelenleben des Kleinkindes und andere Beiträge zur Psychoanalyse;2015;Psychoanalyse, Kleinkinder, Kinder, Seele;Dieser Band vereinigt die wichtigsten Arbeiten, die Melanie Klein im Laufe ihres Lebens veröffentlicht hat. Den Mittelpunkt ihrer Forschungen bildet die Kinderanalyse, die durch die von ihr entwickelte Spieltechnik erst ermöglicht worden war. Die Kinderanalyse eröffnete ihr den Zugang zu den frühkindlichen Konflikten und erlaubte ihr, die Erkenntnisse Freuds aus der direkten analytischen Beobachtung abzuleiten und zu bestätigen. Die weiteren Arbeiten des vorliegenden Bandes zeigen Melanie Klein hauptsächlich als Klinikerin und als einfühlsame Beobachterin unbewusster Prozesse.;978-3-608-94722-9;Deutsch
Knill;Knill;Paolo J.;Ausdruckstherapie, Künstlerischer Ausdruck in Therapie und Erziehung als intermediate Methode;1992;Ausdruckstherapie;Dieses Buch ist der Versuch einer umfassenden Darstellung der Ausdruckstherapie als intermediate Methode für alle therapeutischen, sonderpädagogischen und pädagogischen Praxisfelder. Praktische Handlungsmodelle, wie Musik, Bewegung, Szene, Malen/bildnerisches Gestalten, Sprache usw., die gezielt zur Streuerung von Gruppenprozessen bei Kindern, Jugendlichen und Erwachsenen eingesetzt werden können, sind in diesem Buch mit zahlreichen Schautafeln verbunden, die die Einsetzbarkeit der Medien, deren Wirkung und deren spätere Bearbeitung veranschaulichen helfen - vor dem Hintergrund der verwandten Therapien wie Gesprächstherapie, Psychodrama, Musiktherapie, Kunsttherapie u.a. Als psychotherapeutische Sonderform.;3-87204-417-6;Deutsch
Siehe Schwertfeger, Bärbel;Koch;Klaus;Der Therapieführer. Die wichtigsten Formen und Methoden;1989;;Therapeutische Hilfe - aber wie? Wann ist eine Therapie angezeigt? Was ist Psychosomatik? Wie lange dauert und was kostet eine Therapie? Wann sollte man einen Psychologen und wann einen Psychotherapeuten aufsuchen? Was ist der Unterschied zwischen Neurose und Psychose? Präzise Antworten auf diese und viele weitere Fragen stellen Bärbel Schwertfeger und Klaus Koch in diesem Standartwegweiser durch das Therapieangebot. Sie stellen die wichtigsten Psychotherapien vor und geben eine Fülle praktischer Hinweise.;;Deutsch
Kreutz;Kreutz;Gunter;Warum singen glücklich macht;2014;Singen, Glück, Wohlbefinden;"Warum singen wir so gerne miteinander? Sind Menschen glücklicher, die über Jahre und Jahrzehnte in einen Chor gehen? Ist Singen vielleicht sogar gesund? Singen – und zwar nicht nur an Geburtstagen oder zu Weihnachten – ist weder aus der Evolution des Menschen noch aus seiner Entwicklung vom Säugling bis ins hohe Alter wegzudenken. Mehr noch: Gemeinsames Singen steigert das Wohlbefinden, stärkt Abwehrkräfte und Atmung, schützt vor Stimmproblemen und verbindet uns über alle Generationen und Lebenslagen hinweg miteinander. 

Singen im Chor ist also nicht nur etwas für Überzeugungstäter, sondern kann helfen, wenn es uns einmal schlecht geht. So können Menschen mit gesundheitlichen Problemen das Singen als rezeptfreie und nebenwirkungsarme Therapie mit Spaßfaktor entdecken. Dieses Buch bringt die wissenschaftlichen Erkenntnisse der Psychologie und Hirnforschung auf den Punkt und verrät, wie und warum Singen glücklich macht.
";978-3-8379-2395-7;Deutsch
Kuntsche;Kuntsche;Annette;Kinder mit schweren Behinderungen in der Musiktherapie. Zwischen annehmen, spüren, Begegnen und entdecken;2011;Behinderung, ;Aus der musiktherapeutischen Arbeit entstand ein Konzeptentwurf für die EInzelmusiktherapie mit Kindern und Jugendlichen mit schweren Behinderungen. Die Autorin führt grundlegend in das Thema ein, indem sie die Situationen on Kind und Therapeut*in, gesellschaftliche Einflusfaktoren wie auch die Wirkungsweise der Musik erörtert. Es folgen Überlegungen zu Zielsetzungen und Rahmenbedingungen einer musiktherapeutischen Behandlung in Abgrenzung zu pädagogischem Arbeiten. Vorschläge zur konkreten theoriegeleiteten Praxis werden durch Fallvignetten aus einer Einzelmusiktherapeutie veranschaulicht.;978-3-89500-841-2;Deutsch
Kümmel;Kümmel;Werner-Friedrich;Musik und Medizin. Ihre Wechselbeziehungen in Theorie und Praxis von 800 bis 1800;1977;Musik Medizin;Dieses Buch bringt die erste umfassende interdisziplinäre Darstellung der Web Wechselbeziehungen zwischen Musik und Medizin von 800-1800 hinsichtlich ihrer gedanklich theoretischen Berührungspunkte sowie der praktische therapeutischen Anwendung der Musik, erarbeitet aus einem bisher kaum erschlossen in medizinischen, Musik theoretischen und kulturgeschichtlichen Quellmaterial. Die große Zahl der ins Deutsche übersetzen Quellen und die Abbildung gewähren unmittelbaren Einblick in eine Fülle von Einzelaspekte des Themas. Von den in der antike geschaffenen Voraussetzungen Herr nahm die Musik, wie Kümmel zeigt, Jahrhunderte lang einen festen Platz in der Medizin ein, sowohl im Rahmen der die fertig zum Schutz der Gesundheit als auch bei der kranken Behandlung. Damit wird eine bisher wenig beachtet Funktion der Musik vor Augen geführt und zugleich ein Kapitel aus der Geschichte der medizinischen die Ethik geschrieben, deren Erforschung erst in den Anfängen steht. Darüber hinaus würdigt der Verfasser erstmals gebührend die Bedeutung und Eigenständigkeit des Mittelalters auf diesem Gebiet, insbesondere die entscheidende Rolle der arabischen Ärzte und Gelehrten. Der Musik therapeutisch engagierte Arzt und der im weitesten Sinne kulturgeschichtlich interessierte Leser lernten Kümmels Werk psychosomatische Beobachtung und Überlegungen frühere Zeiten kennen, die auf Institution und Erfahrung beruhen und – Abgleich vom modern medizinischen Denken weit entfernt – teilweise zu erstaunlichen Einsichten und Behandlungsfolgen führten.          ;3-495-49602-5;Deutsch
Lauchauer;Lauchauer;Rudolf;Der Fokus in der Psychotherapie. Fokalsätze und ihre Anwendung in Kurztherapie und anderen Formen analytischer Psychotherapie;1992;Psychotherapie, Fokalsätze;"Die Erarbeitung einer Hypothese über die zentrale unbewusste Dynamik eines aktuellen Problems oder Symptoms des Patienten steht im Mittelpunkt dieses Buches. Schritt für Schritt wird die Bildung eines Fokalsatzes an zahlreichen Fallbeispielen eingeübt; ein zweiter Teil erklärt die Anwendung des Fokalsatzes in der Therapie. Ein unverzichtbares Verfahren in Kurztherapie, Krisenintervention und psychologischer Beratung, aber auch bei langfristigen Psychoanalysen.";3-7904-0593-0;Deutsch
LSV;Landschaftsverband ;Rheinland;Kreativtherapien Wissenschaftliche Akzente und Tendenzen;2003;Psychiatrie, Heilpädagogik;Behandelt die Therapieansätze der: Dramatherapie, Kunsttherapie, Musiktherapie, Tanztherapie und Kreativtherapie;3924182558;Deutsch
Langen;Langen;Dietrich;Autogenes Training. ;;Autogenes Training, Anleitungq;Ruhe und Kraft im Alltag. Das Autogene Training praktisch angewandt, vermittelt RUhe und Gelassenheit im Alltag. In den Überungen, Ruhe-, Schwere-, Wärme-, und Atem-Übung, kommen Körper ud Seele zu einer tiefen Entspannung. Individuelle Formeln helfen bei persönlichen Problemen. Dieser Ratgeber, der die von Professor Langen vereinfachte Form der konzentrativen Selbstentspannung vorstellt, hilft jedem Gesunden, das Autogene TRaining zu erlernen, uns es jeder Zeit und überall durchzuführen - zum Abschalten, Loslassen, Erholen.;3-7742-2194-4;Deutsch
Leidecker;Leidecker;Klaus;Musik als Begegnung. Schöpferisches Handeln zwischen Pädagogik und Therapie;2002;Pädagogik, Begegnung;"Unsere Zeit fordert Besinnung auf ureigene Krafte der Musik als Profession im Spannungsfeld zwischen Kunst, Padagogik und Therapie und gleichzeitig ihre naturliche Einbindung in aktuelle gesellschaftliche Problemstellungen: Musik als Begegnung ""sucht"" den Menschen auf - als Ubenden, als Lernenden, als Sich-Entwickelnden, als Klienten ... - im Kontakt mit seinen individuellen Kraftquellen, im Kontakt mit der Welt als Komposition, als Spiegel. Musik kann Seismograf und Wegbegleiter sein, davon erzahlt dieses Buch. Als Themenbereiche werden Akustische Okologie, Elementare Musik, auch Beitrage zur Musikanthropologie angesprochen sowie methodisch-didaktische Ansatze aus der Werkstatt-Arbeit des Autors mit Musik- und Sozialpadagogik-StudentInnen. Musik als Begegnung meint auch Raume musikalisch-therapeutischer Wahrnehmung, Begegnung, Methode: Die Studie ""Klange der Betaubung"" skizziert Wege musiktherapeutischen Handelns in der Arbeit mit Alkoholikern. Als Adressaten dieser Schrift sind MusikpadagogInnen, SozialpadagogInnen, Musiker, Musiktherapeuten, auch andere TherapeutInnen oder verwandte Ausbildungen und Berufe angesprochen. Es sind ""Horende"" gemeint, Menschen, die hin-, zu-, dazwischenhoren und -horchen wollen und die Entwurfe des Autors auch als Ermutigung verstehen, ihre eigenen musikalisch-schopferischen Wege zu suchen, zu finden und zu verwirklichen. Eine padagogische bzw. therapeutische Haltung der Ermutigung ist dem Autor in seiner praktischen Arbeit von besonderer Bedeutung. Diese Ermutigung vermag u. a. besondere Impulse fur das je eigene Entwickeln von Kreativitat zu geben und heilsame Erkenntnisprozesse auszulosen.";3-89500-256-9;Deutsch
Leuner;Leuner;Hanscarl;Katathymes Bilderleben. Grundstufe. Einführung in die Psychotherapie mit der Tagtraumtechnik. Ein Seminar;1982;Tagtraumtechnik, Katathymes Bilderleben;Die Tagtraumtechnik des Katathymen Bilderlebens durchzieht eine klare Struktur bis hin zu seiner didaktischen Gliederung in Grund-, Mittel- und Oberstufe. Trotzdem erlaubt das Verfahren die freie assoziative und kreative Entfaltung des Tagtraumphantasien. Dieses Buch beschränkt sich auf die besonders wichtige Grundstufe. In leicht lesbarer seminaristischer Darstellung führt es Leser ein, die ihre erste Bekanntschaft mit dem Katathymen Bilderleben machen wollen. Gleichzeitig ist es eine Hilfe für diejenigen, die ihr in Kursen und Seminaren gewonnenes Wissen für eine zukünftige therapeutische Tätigkeit festigen und ergänzen möchten.;3-13-464403-7;Deutsch
