Signatur;Autor:in Nachname;Autor:in Vorname;Titel;Jahr der Veröffentlichung;Schlagwort;Klappentext;ISBN;Sprache
Perret;Perret;Daniel;Roots of Musicality. Music Therapy and personal development;2005;Persönlichkeitsentwicklung, Musikalität, Musiktherapie ;This is a book about music and the human spirit. It...explain[s] how the spirit of a child may be enlivened by music. Daniel Perret plays in dialogue with young minds and bodies to liberate them from restraint and isolation. There is always a chance that music will spark the fire of life and creativity, setting a spirit free and bringing happiness. In skilled and sympathetic hands, it can educate and heal. -- From the Foreword by Colwyn Trevarthen I would recommend it to music therapists who are seeking another frame of reference for their work or new musical ideas. -- Australian Journal of Music Therapy;978-1843103363;Englisch
Plahl;Plahl, Koch-Temming;Christine;Musiktherapie mit Kindern. Grundlagen - Methoden -Praxisfelder;2005;Musiktherapie mit Kindern. Grundlagen - Methoden -Praxisfelder;"Musiktherapie mit Kindern wird heute in vielen Bereichen praktiziert - in der Sozialpädiatrie, der Kinder- und Jugendpsychiatrie, in Schulen und Heimen ebenso wie in musiktherapeutischen Praxen. Das breit angelegte Buch verbindet in einzigartiger Form Theorie und Praxis der Musiktherapie mit Kindern: Orientiert an der Praxis musiktherapeutischen Vorgehens werden neben musikalischen, psychologischen und soziologischen Grundlagen die Indikationen, das diagnostische und methodische Vorgehen sowie aktuelle Ergebnisse der musiktherapeutischen Wirksamkeitsforschung umfassend präsentiert. Es werden neue Entwicklungen in der Musiktherapie mit Kindern aufgezeigt und das breite Spektrum musiktherapeutischer Praxis wird anhand zahlreicher Fallberichte veranschaulicht - von der Behandlung autistischer und traumatisierter Kinder bis hin zur Musiktherapie mit Kindern aus Migrationsfamilien. Das Buch stellt in verständlicher und umfassender Form die vielfältigen Möglichkeiten musiktherapeutischer Behandlung von Kindern dar und wendet sich als Grundlagenwerk an alle, die in medizinischen, psychologischen, pädagogischen, sozialpädagogischen oder kreativ-therapeutischen Kontexten mit Kindern arbeiten; ebenso an Eltern, Kostenträger und andere Interessierte, die sich über den aktuellen Stand der Musiktherapie mit Kindern informieren wollen.";	9783456945897;Deutsch
Priestley01;Priestley;Mary;Musiktherapeutische Erfahrungen ;1975;Analytische Musiktherapie, Methodik, Anwendung;Das vorliegende Buch gibt einen Eindruck in die inhaltliche und methodische Ausrichtung analytischer Musiktherapie. Dabei sind Hinweise zur Instrumenten Auswahl und zur Studieninhalten genauso berücksichtigt, wie konkrete Möglichkeiten der Psychohygiene für Musiktherapeuten. Ein persönliches Verständnis von Musik wird dem Leser vor Augen geführt, dass auch therapiefremden Arbeitsfeldern weiterführende Perspektiven für den Umgang mit Musik öffnet. Dieses Werk ist der erste Band der Reihe „Praxis der Musiktherapie“, die wichtige Arbeiten zu Musiktherapie sowohl als Original Text wie eine Übersetzung Verein soll.;3– 7618 – 0682 – 5;Deutsch
Priestley01a;Priestley;Mary;Musiktherapeutische Erfahrungen ;1975;Analytische Musiktherapie, Methodik, Anwendung;Das vorliegende Buch gibt einen Eindruck in die inhaltliche und methodische Ausrichtung analytischer Musiktherapie. Dabei sind Hinweise zur Instrumenten Auswahl und zur Studieninhalten genauso berücksichtigt, wie konkrete Möglichkeiten der Psychohygiene für Musiktherapeuten. Ein persönliches Verständnis von Musik wird dem Leser vor Augen geführt, dass auch therapiefremden Arbeitsfeldern weiterführende Perspektiven für den Umgang mit Musik öffnet. Dieses Werk ist der erste Band der Reihe „Praxis der Musiktherapie“, die wichtige Arbeiten zu Musiktherapie sowohl als Original Text wie eine Übersetzung Verein soll.;3– 7618 – 0682 – 5;Deutsch
Priestley02;Priestley;Mary;Analytische Musiktherapie;1983;Analytische Musiktherapie;"Konzepte der Human Wissenschaften. Die Wände dieses Programms beschreiben und begründen Veränderungen in der Behandlung von Menschen durch Menschen. Wir haben an solchen Veränderung teil; wir bewirken Sie, wir sind Ihnen ausgesetzt. Entscheidungen darüber, ob sich der Spielraum menschlichen Verhaltens unter dem Drucktechnologische Neuerungen einschränkt oder erweitert, fallen jeden Tag, besonders in der Praxis der sozial – und Erziehungsberufe. Die Bücher unseres Programms sind Mittel, Erfahrungen aus dieser Praxis zu prüfen, zu verallgemeinern und nachvollziehen. ";3-608-95186-5;Deutsch
Priestley02a;Priestley;Mary;Analytische Musiktherapie;1983;Analytische Musiktherapie;"Konzepte der Human Wissenschaften. Die Wände dieses Programms beschreiben und begründen Veränderungen in der Behandlung von Menschen durch Menschen. Wir haben an solchen Veränderung teil; wir bewirken Sie, wir sind Ihnen ausgesetzt. Entscheidungen darüber, ob sich der Spielraum menschlichen Verhaltens unter dem Drucktechnologische Neuerungen einschränkt oder erweitert, fallen jeden Tag, besonders in der Praxis der sozial – und Erziehungsberufe. Die Bücher unseres Programms sind Mittel, Erfahrungen aus dieser Praxis zu prüfen, zu verallgemeinern und nachvollziehen. ";3-608-95186-5;Deutsch
Radbruch;Radbruch;Christoph;Lehrbuch von Palliativmedizin (für weitere Angaben siehe Aulbert);;;;;Deutsch
Renz;Renz;Monika;Zwischen Urangst und Urvertrauen. Therapie früher Stölrungen über Musik-, Symbol-, und spirituelle Erfahrungen. Mit einem Vorwort von Prof. Dr. Med. H.S. Herzka;1996;Urangst, Urvertrauen, Therapie früher Störungen;"Zu Grunde gehen oder auf dem Grund gehen?So ähnlich lautete die Frage der Autoren in ihr der persönlichen Ausgangslage, als sie, mit immer neuen Krankheiten konfrontiert, über Jahre ratlos nach Hintergründen der Leiden suchte. Das vorliegende Buch ist über solche Erfahrungen entstanden. Es wird selbst zum „Abstieg in eine tiefere Ebene“: konkret nachvollziehbar anhand zahlreicher Beispiele von Menschen, die den Gang ins Labyrinth sagten; theoretisch im Versuch, zu begreifen, welche Themen und Ängste auf diesem Gang angeschaut werden müssen und welche Kräfte dabei frei werden. Das Buch bleibt aber nicht bei Berichten therapeutische Aufarbeitung stehen. Es wagt, Bezüge herzustellen zur frühen menschlichen Entwicklung. Zahlreiche Leiden werden neu einstellbar, wenn früher Entwicklung – außerhalb dessen, was derzeit wissenschaftlich erforschtbar ist - als geheimnisvoller Übergang von einem grundsätzlich anderen Zustand in das sinnhaft körperliche Dasein betrachtet wird. Etwas im Menschen lebt in einem Bereich und kommt aus einem Ort jenseits dessen, was Menschen zu erfassen oder in Ihrem Gedächtnis zu speichern vermögen. Wie fühlt es sich an, von dort Abschied zu nehmen und hier anzukommen?@Welche Zeit menschliche Entwicklung fällt dieser Übergang? Wie mag wohl ein ungeborenes, ein Säugling selbst sein heran reifen empfinden? Wie fühlt sich das da – sein an, wenn mit beginnenden Sinneswahrnehmung schon im Bauchraum der Mutter liche Herzschlag und die Mutter Stimme gehört werden? Sind sich Erfahrungen in den frühsten Kindheit und solche in größter Todesnähe – trotz aller Verschiedenheit – ähnlich? Was aus der Perspektive des ungeborenen und des Oh Säuglings genau empfunden wird, wird immer und beschreibbar bleiben. Es ist aber möglich, sich später diesen mutmaßlichen empfinden von einst über Körperbotschaften und Imagination über Reaktionen auf Klänge und Rhythmen, über Besonderheiten aus grenzspringenden Therapieverläufen nochmals an zu nähern. Es entstand ein Modell menschliche Entwicklung, dass wir standen sein will als eine Gesamtschau, die Freud von Leid neu erklären kann. „Der Text unterstreicht mit Treffen der Begrifflichkeit und mit eindrücklich den Fallbeispielen die große Bedeutung des Mediums Musik in der Therapie von Menschen mit frühen Störung… So wird das Medium Musik durch einen eigenen Ansatz detailliert und systematisch in einem entwicklungspsychologischen Konzept verankert. Die Einmalige Wirkung von Musik in der Therapie und in Heilungsritualen wird dadurch auf neue Art verständlich.“ – Fritz Hegi   Moni Karenz Right sich mit ihrer Arbeit in die vordersten Linie der jenigen ein, welche die Umrisse eines neuen Menschen Bilder skizzieren, eines Konzepts, welches auf Bewegung und auch Verbundenheit mit dem Kosmos beruht, und gleichzeitig die Besonderheiten des Menschen berücksichtigt.“ – Professor Doktor mäht H. S. Herzka     ";3-87387-263-3;Deutsch
Richter;Richter;Horst-Eberhard;Das Ende der Egomanie. Die Kriese des wesentlichen Bewusstseins;2002;Egomanie;"""Das Ende der Egomanie"", heißt der kühne Buchtitel. Natürlich ist die kulturelle Egomanie noch nicht zu Ende. Sie wird, wie auch in der Regel die individuelle manische Krankheit, alle Anstrengungen aufbitten, sich trotz ihrer selbstzerstörerischen Tendenz noch weiter zu behaupten. Aber als vertretbaresprojekt ist sie am Ende, und ist es, als müsste sie mit dem entfesselt hin absurden Bombenkrieg nur ihre Pathologie beziehungsweise ihren geistigen Bankrott noch einmal vor aller Welt drastisch beweisen.""";3-462-03087-6;Deutsch
Ridder;Ridder;Paul;Musik für Leib und Seele. Musiktherapie in der Medizingeschichte;2006;Musiktherapie in der Medizingeschichte;So eine Gewissheit antiken Musik Denkens bildet die Ansicht, Musik sei angewandte Mathematik. Die Arithmetisch geordnete Musik könne die Seele beeinflussen, weil diese ebenfalls mathematisch geprägt sei. Die Bewegungen von Trauer oder Freude, Furcht oder Hoffnung, Zorn oder Zärtlichkeit lasse sich in musikalische Formen übersetzen, die nun ihrerseits das seelische Geschehen steuern und sein Gleichgewicht wieder herstellen. Eine Gesamtdarstellung der Musik Geschichte als Geschichte ärztlicher Seelenführung lag bisher nicht vor. Dabei gehört doch die musikalische Praxis des Arztes zur Erhaltung Oh der Gesundheit und Heilung von Krankheit zu den historische gesicherten Tat bestanden. In allen Epochen haben Komponisten und Musik Schriftsteller die kunstvolle zeitgestaltung in den Formen der Musik für das Mittel musiktherapeutischer Wirkung gehalten.      ;3-9807065-5-9;Deutsch
Ringer;Ringer;Christoph;Problemorientierte Musiktherapie. Ein integratives Konzept (für weitere Info siehe Blaser, Andreas);;;;;Deutsch
Rohde-Dachser;Rohde-Dachser;Christa;Das Borderline-Syndrom. Fünfte völlig überarbeitete und ergänzte Auflage.;1997;Borderline-Syndrom;"In dieser Monografie wird das klinische Erscheinungsbild der Borderline-
Erkrankungen und die zugrunde liegende Ich-Pathologie beschrieben. Es wird 
gezeigt, welche genetischen Wurzeln die Borderline-Erkrankungen haben
können. Die Autorin entwickelt ein Konzept für die Borderline-Therapie, das
sich an der spezifischen Ich-Störung dieser Patienten orientiert. Sie begründet die Notwendigkeit der Modifizierung des psychoanalytischen Standardverfahrens. 

Anhand zahlreicher klinischer Beispiele demonstriert sie die Besonderheiten der therapeutischen Beziehung in der Borderline-Therapie, die Interventionstechnik und den Umgang mit der Regression des Patienten einschließlich einer möglichen Übertragungspsychose. Sie fasst die differentialdiagnostischen und prognostischen Überlegungen zusammen und informiert in einem Anhang über verschiedene Möglichkeiten, die Borderline-Therapie zu objektivieren. Der Anhang enthält zudem eine von John G. Gunderson authorisierte Fassung des Diagnostischen Interviews für Borderline-Patienten (DIB-R). ";345684087X;Deutsch
Ruud;Ruud;Even;Meta-Musiktherapie. Wege zu einer Theorie der Musiktherapie;1992;Theorie;"Dieser Band beschreibt ein in (Meter-)theoretisches oh System der Musiktherapie auf der Grundlage der verschiedenen Denkmodelle von Medizin, Psychoanalyse, Lerntheorie und Humanistischer Psychologie. Der größte Teil der bekannten Musiktherapie – Methoden wird in dieses System integriert. Die Autoren stellen die theoretischen Grundlagen gut nachvollziehbar da. Auf Basis der theoretischen Grundlagen werden auch spezielle Aspekte dieser noch jungen Therapiedisziplin beleuchtet, wie etwa Improvisation und Interaktion sowie Fragen nach ihrer gesellschaftlichen und kulturellen Bedeutung. Für alle, die sich in Praxis, Forschung und Ausbildung mit Musiktherapie befassen, bildet ""Meta-Musiktherapie"" eine wichtige Informationsquelle und Orientierungshilfe.   ";0177-8447;Deutsch
Seidel01;Seidel;Almut;Verschmerzen. Musiktherapie mit krebskranken Frauenn und Männern im Spannungsfeld von kurzatmiger und paliliativer Behandlung;2005;Musiktherapie mit Krebskranken, Gender;Verschmerzen ist die Dokumentation eines Musik therapeutisch onkologischen Forschungsprojekt im Spannungsfeld von Curativa und Palliative Arbeit mit Krebspatienten beiderlei Geschlechts. Sie wird hier in ihren weitreichenden institutionellen konzeptionellen methodischen und personalen Implikationen diskutiert neben dieser grundlegenden Darstellung des Arbeitsfeldes gibt es zwei weitere Fokussierung in: einerseits wird das Verhältnis Sprache – Musik – machen MusikTherapieprozess als jeweils integrierenden oder polarisierenden Heilfaktor ausgeleuchtet und andererseits der Frage einer geschlechtsspezifischen Rezeption des Musiktherapie Angebotes nachgegangen. Ihr Mittelpunkt des Forschungsinteresses stehen demgemäß Substanz und Qualität, Kontext Bedingungen und konzeptionelle Bestandteile von Musiktherapie in der Psychoonkologie unter besonderer Berücksichtigung des Janda Aspekt des Forschungsdesigns fokussiert auf der einen Seite - hier unter Canon Minologisch – hermeneutischen Aspekten – die entstehenden musikalischen Produktionen und auf der anderen Seite – jetzt mithilfe der sequenzielle Text Analyse – die begleitenden verbalen Interaktion im Prozess ausgewählter Therapiesitzungen. Flankierend wird ein qualitatives Verfahren zur Befindlichkeitsmessung hinzugezogen.;3-89500-457-X;Deutsch
Seidel01a;Seidel;Almut;Verschmerzen. Musiktherapie mit krebskranken Frauenn und Männern im Spannungsfeld von kurzatmiger und paliliativer Behandlung;2005;Musiktherapie mit Krebskranken, Gender;Verschmerzen ist die Dokumentation eines Musik therapeutisch onkologischen Forschungsprojekt im Spannungsfeld von Curativa und Palliative Arbeit mit Krebspatienten beiderlei Geschlechts. Sie wird hier in ihren weitreichenden institutionellen konzeptionellen methodischen und personalen Implikationen diskutiert neben dieser grundlegenden Darstellung des Arbeitsfeldes gibt es zwei weitere Fokussierung in: einerseits wird das Verhältnis Sprache – Musik – machen MusikTherapieprozess als jeweils integrierenden oder polarisierenden Heilfaktor ausgeleuchtet und andererseits der Frage einer geschlechtsspezifischen Rezeption des Musiktherapie Angebotes nachgegangen. Ihr Mittelpunkt des Forschungsinteresses stehen demgemäß Substanz und Qualität, Kontext Bedingungen und konzeptionelle Bestandteile von Musiktherapie in der Psychoonkologie unter besonderer Berücksichtigung des Janda Aspekt des Forschungsdesigns fokussiert auf der einen Seite - hier unter Canon Minologisch – hermeneutischen Aspekten – die entstehenden musikalischen Produktionen und auf der anderen Seite – jetzt mithilfe der sequenzielle Text Analyse – die begleitenden verbalen Interaktion im Prozess ausgewählter Therapiesitzungen. Flankierend wird ein qualitatives Verfahren zur Befindlichkeitsmessung hinzugezogen.;3-89500-457-X;Deutsch
Sigrun Krausse01;Sigrun Krausse;Elisabeth;Musik- und Hörtherapie bei Tinnitus und Hyperakusis;2012;Tinnitus und Hyperakusis;"Tinnitus ist ein Symptom gestörter Hörwahrnehmung, welches in den westlichen Industrienationen immer häufiger zu beobachten ist.
8 Prozent der Deutschen und der Schweizer kennen Tinnitus aus eigener Erfahrung; 4 Prozent haben chronisch Ohrgeräusche. In 40 Prozent der Fälle von chronischem Tinnitus liegt auch eine Hyperakusis vor. Die Ursache von Tinnitus ist in 90 Prozent eine Schwerhörigkeit - vorwiegend eine Schallempfindungsschwerhörigkeit, während die Hyperakusis immer psychisch bedingt ist.
In der Schweiz konnte erstmals 2006 für die schwergradig von Tinnitus und Hyperakusis Betroffenen mit der Gründung der Tinnitusklinik Chur ein stationäres Therapieangebot geschaffen werden, welches neben verhaltenstherapeutischen Ansätzen als wesentlichen Baustein die Musik- und Hörtherapie umfasst. 
Ziel dieses Buches ist es, die Pathogenese, die aktuellen Forschung, Diagnostik und Therapie von Tinnitus und Hyperakusis darzustellen, speziell einen Überblick über die Bestandteile musik- und hörtherapeutischer Behandlung an der Schnittstelle von Musikmedizin und Psychotherapie zu geben. 
Das vorliegende Buch ist in gleichem Maße für von Tinnitus und Hyperakusis Betroffene wie für Therapeuten - Musik- und Hörtherapeuten, Ärzte und Psychologen - interessant.";978-3-89500-888-7;Deutsch
Sigrun Krausse01a;Sigrun Krausse;Elisabeth;Musik- und Hörtherapie bei Tinnitus und Hyperakusis;2012;Tinnitus und Hyperakusis;"Tinnitus ist ein Symptom gestörter Hörwahrnehmung, welches in den westlichen Industrienationen immer häufiger zu beobachten ist.
8 Prozent der Deutschen und der Schweizer kennen Tinnitus aus eigener Erfahrung; 4 Prozent haben chronisch Ohrgeräusche. In 40 Prozent der Fälle von chronischem Tinnitus liegt auch eine Hyperakusis vor. Die Ursache von Tinnitus ist in 90 Prozent eine Schwerhörigkeit - vorwiegend eine Schallempfindungsschwerhörigkeit, während die Hyperakusis immer psychisch bedingt ist.
In der Schweiz konnte erstmals 2006 für die schwergradig von Tinnitus und Hyperakusis Betroffenen mit der Gründung der Tinnitusklinik Chur ein stationäres Therapieangebot geschaffen werden, welches neben verhaltenstherapeutischen Ansätzen als wesentlichen Baustein die Musik- und Hörtherapie umfasst. 
Ziel dieses Buches ist es, die Pathogenese, die aktuellen Forschung, Diagnostik und Therapie von Tinnitus und Hyperakusis darzustellen, speziell einen Überblick über die Bestandteile musik- und hörtherapeutischer Behandlung an der Schnittstelle von Musikmedizin und Psychotherapie zu geben. 
Das vorliegende Buch ist in gleichem Maße für von Tinnitus und Hyperakusis Betroffene wie für Therapeuten - Musik- und Hörtherapeuten, Ärzte und Psychologen - interessant.";978-3-89500-888-7;Deutsch
Sigrun Krausse01b;Sigrun Krausse;Elisabeth;Musik- und Hörtherapie bei Tinnitus und Hyperakusis;2012;Tinnitus und Hyperakusis;"Tinnitus ist ein Symptom gestörter Hörwahrnehmung, welches in den westlichen Industrienationen immer häufiger zu beobachten ist.
8 Prozent der Deutschen und der Schweizer kennen Tinnitus aus eigener Erfahrung; 4 Prozent haben chronisch Ohrgeräusche. In 40 Prozent der Fälle von chronischem Tinnitus liegt auch eine Hyperakusis vor. Die Ursache von Tinnitus ist in 90 Prozent eine Schwerhörigkeit - vorwiegend eine Schallempfindungsschwerhörigkeit, während die Hyperakusis immer psychisch bedingt ist.
In der Schweiz konnte erstmals 2006 für die schwergradig von Tinnitus und Hyperakusis Betroffenen mit der Gründung der Tinnitusklinik Chur ein stationäres Therapieangebot geschaffen werden, welches neben verhaltenstherapeutischen Ansätzen als wesentlichen Baustein die Musik- und Hörtherapie umfasst. 
Ziel dieses Buches ist es, die Pathogenese, die aktuellen Forschung, Diagnostik und Therapie von Tinnitus und Hyperakusis darzustellen, speziell einen Überblick über die Bestandteile musik- und hörtherapeutischer Behandlung an der Schnittstelle von Musikmedizin und Psychotherapie zu geben. 
Das vorliegende Buch ist in gleichem Maße für von Tinnitus und Hyperakusis Betroffene wie für Therapeuten - Musik- und Hörtherapeuten, Ärzte und Psychologen - interessant.";978-3-89500-888-7;Deutsch
Schaller;Schaller, Schemmel;Johannes;Ressourcen...Ein Hand- und Lesebuch zur psychotherapeutischen Arbeit;2013;Ressourcenorientiertes therapeutisches Vorgehen;Ressourcen ... dieser Begriff hat sich im psychosozialen Kontext zu dem Zauberwort entwickelt. Was verbirgt sich hinter der Vokabel, was versteht man unter ressourcenorientiertem oder -aktivierendem therapeutischen Vorgehen? Dieses Buch bietet eine Übersicht über den aktuellen Diskussions- und Forschungsstand zum Schlag- und Modewort Ressourcen. Von den theoretischen Perspektiven ausgehend wurde der Schwerpunkt des Handbuches darauf gelegt, praktisches Handwerkszeug für eine ressourcenaktivierende Arbeit mit KlientInnen zur Verfügung zu stellen. Insgesamt 40 Beiträge bieten eine therapieschulenübergreifende Vielfalt an theoretischen und praktischen Anregungen sowie Einblicke aus der praktischen Arbeit angefangen von der ressourcenorientierten Gesprächsführung bis hin zu den verhaltenstherapeutischen Ansätzen oder Beiträgen zur Selbstfürsorge. Dieses in der zweiten Auflage stark erweiterte Werk, in dem eine Vielzahl verschiedenster und renommierter AutorInnen zu Wort kommt, ist damit das Standardbuch für alle, die sich mit dem Thema Ressourcen auseinandersetzen, sei es aus theoretischem Interesse oder für eine kritische Reflexion der eigenen psychosozialen Praxis.;38 71592412;Deutsch
Schäfer;Schäfer;Magdalene Julia;Musiktherapie als Heilpädagogik bei verhaltensauffälligen Kindern;1985;Heilpädagogik, Kinder, Jugendliche, verhaltensauffälligkeit;Aus der Praxis für die Praxis: im ersten Band dieser von Heilpädagogen und Psychotherapeuten Professor Doktor Aloys Leber herausgegeben in Reihe lässt die Verfasserin den Leser an dem Abenteuer angehen der Heilpädagogen mit verhaltensauffälligen, im Lernen behinderten Kindern einer sozialen Randgruppe teilnehmen. Aus einem kurzen Rückblick auf die Geschichte der Musiktherapie entwickelt sie ihre eigenen, an der Schreiblauer‘schen Rhythmik wie an der Psychoanalyse orientierten Ansatz. Sie gibt einen Einblick in die desolaten Verhältnisse der Bewohner einer Not Unterkunft und schildert dann ihre Erfahrungen in zwei Musikgruppen mit Kindern aus diesem Getto.;3893340939;Deutsch
Schemmel;Schemmel;Heike;Ressourcen...;;;;;Deutsch
Schmidt;Schmidt, Stegemann, Spitzer;Hans Ulrich;Musiktherapie bei psychischen und psychosomatischen Störungen;2019;Psychische Störung, Psychosomatische Störung, Handlungsmöglichkeiten;"Das Buch informiert Sie über die zahlreichen Einsatzmöglichkeiten der Musiktherapie zur Behandlung psychischer und psychosomatischer Störungen.

Neben der Darstellung verschiedener Störungsbilder bei Kindern, Jugendlichen und Erwachsenen und deren Besonderheiten, stellt das Buch praktische Aspekte der Behandlung und aktuelle Forschungsergebnisse aus Medizin und Musiktherapie vor.

Sie erfahren, wie Musiktherapie den Heilungsprozess unterstützen kann und wie Ärzte und Musiktherapeuten zusammenarbeiten können, um bestmögliche Behandlungsergebnisse zu erzielen.";978-3-437-21113-3;Deutsch
Schroeder;Schroeder;Wolfgang C.;Musik. Spiegel der Seele. Eine Einführung in die Musiktherapie;1995;Einführung Musiktherapie;Vor dem Hintergrund verschiedener psychotherapeutischer Schulen entwickelt der Autor sein integratives Musiktherapiekonzept und erweitert es durch Theorie und Prais verschiedener humanistischer Verfahren (Gestalttherapie, Psychodrama, Psychosynthese, Themenzentrierte Interaktion, Katathymes Bilderleben) (...);9 783873870697;Deutsch
Schubert;Schubert;Gertrud;Klänge und Farben ;1982;Klänge, Farben, Wirkung;"Praxis der Musiktherapie, 2. - Hrsg. v. Volker Bolay & Volker Bernius. - Stuttgart, Gustav Fischer Verlag; Kassel, Bärenreiter Verlag, 1982, 120 pp., 45 Farbabbildungen, orig. kart. Einband. In dem zweiten Band der Reihe Praxis der Musiktherapie"" werden Arbeitsformen mit erwachsenen Psychiatrie-Patienten aufgezeigt., die durch ihre Vielfalt und Kreativität faszinieren.""";3-3437-10776-3;Deutsch
Schumann;Schumann;Claudia;Musiktherapie und Psychoanalyse;1982;Psychoanalyse;"Im Mittelpunkt dieses Buches steht ein aktuelles Konzeot der heutigen Musiktherapie, die ""analytische Musiktherapie"". Es werden Verbindungen aufgezeigt zwischen Psychoanalyse, Musik und Musiktherapie, Methoden der Systematisierung erprobt und Kriterien für kritische Stellungnahmen geliefert. Rund 70 Jahre nach den Arbeiten des Freud-Schülers Max Graf weist die Verfasserin abermals als Musikerin eine grundlegende Kenntnis der Freudschen Gedankengänge und Methoden nach, trägt zusammen, was sich als musikrelevant erweist, vergleicht es mit der Arbeitsweise der englischen Musiktherapeutin Mary Priestley ( deren englischsprachige Schriften die Verfasserin auszugsweise ins Deutsche übersetzt hat), ergänzt es durch eigene Erfahrungen und Fallbeispiele, erweitert die Konzeption Priestleys und systematisiert das Meld der Musiktherapie. Dies ist das erste Buch, das in der Bundesrepublik über ""analytische Musiktherapie"" geschrieben worden ist. Es wird sicherlich seine Supren in nachfolgenden Publikationen hinterlassen. Mit der vorliegenden Arbeit promovierte die Autorin 1980/81 an der Univbersität Duisburg.";3-9800666-0-6;Deutsch
Schwabe01;Schwabe;Christoph;Aktive Gruppenmusiktherapie für erwachsene Patienten;1983;Gruppentherapie, Erwachsene;Der Wand erläutert die Bedeutung der „aktiven Musiktherapie“ innerhalb der Psychotherapie und beschreibt deren Anwendungsmöglichkeiten in der medizinischen Praxis bei der Behandlung von Neurosen. Psychomatrosen im Rahmen der Psychatrie und speziell der Kurorttherapie, Aufbau und Gliederung gewährleisten Ärzten und Therapeuten, die diesen Zweig der Musiktherapie in ihr Behandlungskonzept aufnehmen wollen, eine klare Übersicht und vermitteln auch das notwendige Basiswissen für die Ausbildung.;3-437-10842-5;Deutsch
